"conversation_id_str","created_at","favorite_count","full_text","id_str","image_url","in_reply_to_screen_name","lang","location","quote_count","reply_count","retweet_count","tweet_url","user_id_str","username"
"1805511503598297227","Tue Jun 25 08:01:01 +0000 2024","0","Disepong Istri Orang Tog3e Gaya 69 https://t.co/YdIPJBABXn Laras Bali Viral Full Lengkap 72 https://t.co/hEdpRJMMmF Ngntot Pacar Bule Bali T0ket G3de https://t.co/akMsHvRu5D Saya Darla Toutuber Viral 4 https://t.co/TIqmOQ9JX2","1805511503598297227","","","in","","0","0","0","https://x.com/wtrc9h9879fr5/status/1805511503598297227","773302278958612480","wtrc9h9879fr5"
"1805131007374618869","Mon Jun 24 06:49:04 +0000 2024","0","Video bule diduga melakukan aksi perusakan sebuah rumah milik warga di Kabupaten Gianyar Bali viral di media sosial. Bule asal Alaska tersebut kesal lantaran kesal tak diizinkan memperpanjang kontrak rumah. PAA #Bule #Bali #SeputariNewsPagi #SeputariNewsRCTI https://t.co/tz1PDK7otd","1805131007374618869","https://pbs.twimg.com/media/GQ0c8nLa0AEYh_h.jpg","","in","iNews Tower Jakarta","0","0","0","https://x.com/SeputariNews/status/1805131007374618869","375995332","SeputariNews"
"1804929889277301176","Sun Jun 23 17:29:54 +0000 2024","0","cari pasangan buat swab sex kalo bisa bule #openbo #bobali #pasutribali #bulebali #partner #availbali #openbobali #3some #3somebali","1804929889277301176","","","in","","0","4","0","https://x.com/karinkaliya/status/1804929889277301176","1804921644731052032","karinkaliya"
"1804485393494294783","Sun Jun 23 12:30:07 +0000 2024","0","@neverens bule Bali anjayy ","1804854448382173228","","neverens","in","Indonesia 🇮🇩","0","0","0","https://x.com/cookieraggi/status/1804854448382173228","1287881637544341505","cookieraggi"
"1804485393494294783","Sun Jun 23 11:55:45 +0000 2024","0","@cookieraggi Bener sih ini potong rambut langsung jadi vibe bule Bali yang seneng surfing.. https://t.co/C2eWXm2SBT","1804845797759984050","https://pbs.twimg.com/media/GQwZrlCaQAAVu7_.png","cookieraggi","in","🇹🇭🇨🇳🇰🇷🇯🇵🇺🇲🇹🇼🇵🇭","0","1","0","https://x.com/neverens/status/1804845797759984050","1354436005","neverens"
"1804205547740450822","Sat Jun 22 13:09:57 +0000 2024","1","@NyaiiBubu ini bule bali nir akhlak yaa","1804502085972681140","","NyaiiBubu","in","Dunya","0","1","0","https://x.com/ayufaparwaa/status/1804502085972681140","1335264585633288199","ayufaparwaa"
"1804456094355361901","Sat Jun 22 10:07:35 +0000 2024","0","pov bule bali 40 hari gapunya uang","1804456189243060404","","dickinson6exe","in","","0","4","0","https://x.com/dickinson6exe/status/1804456189243060404","1778695612743245825","dickinson6exe"
"1804276866418905350","Fri Jun 21 22:15:01 +0000 2024","0","POV Ng3we Bule Bali CR00T Dalam https://t.co/j9mK7MeIg5 ABG SMA 0mek Masih Pakai Seragam https://t.co/ZER3Hilhx4 siska ABG cantik ketagihan kentu https://t.co/56xWOtyj8G DiGangb4n9 om2 1 https://t.co/XY8P4hE2gO","1804276866418905350","","","in","","0","0","0","https://x.com/ChiaraPrincess/status/1804276866418905350","258081170","ChiaraPrincess"
"1804194888378143141","Fri Jun 21 17:32:28 +0000 2024","0","@jadelotus_rs aku mau ikut seger bet keknya kalo ada penampakan bule Bali China","1804205758940352987","","jadelotus_rs","in","말랑즈 Part timer Aristocatz","0","1","0","https://x.com/lovewooky/status/1804205758940352987","1390940469727678466","lovewooky"
"1804204352388895195","Fri Jun 21 17:26:52 +0000 2024","0","Guys kalian tau gak di tiktok konten driver ojol jemput bule bali seru dah okay miss isokey miss","1804204352388895195","","","in","Liverpool, England","0","0","0","https://x.com/anctol/status/1804204352388895195","853256565847203840","anctol"
"1804167460121383170","Fri Jun 21 15:00:16 +0000 2024","0","WOI BISA BISANYA aku pernah mikirin osc bule bali pls","1804167460121383170","","","in","Indonesia","0","0","0","https://x.com/hckuetat/status/1804167460121383170","1502467640664915969","hckuetat"
"1804139101735792806","Fri Jun 21 13:07:35 +0000 2024","0","main bumble nyangkut bule bali mulu. mas2 jawa gw swipe right gapernah match anjir ","1804139101735792806","","","in","Milkyway","0","0","0","https://x.com/xerotoneen/status/1804139101735792806","1097105799950696448","xerotoneen"
"1804092977159245890","Fri Jun 21 12:16:22 +0000 2024","0","@Gingerbreadths SO SPECIFIC dialah bule bali Ubud yang deket sama Bli dan Gek lokal","1804126209888170276","","Gingerbreadths","in","Indonesia","0","1","0","https://x.com/nitemanuscript/status/1804126209888170276","1773222111252979712","nitemanuscript"
"1803992405869498858","Fri Jun 21 03:24:40 +0000 2024","1","lagi belajar https://t.co/TW387wKXc4 POV Ng3we Bule Bali CR00T Dalam https://t.co/oqTkGnUs41 Skandal mahasiswi cantik kirim video bugil ke dosen pembimbing https://t.co/Jrs1erIPU2 Enak Gak Bang TT Nya https://t.co/dukkyAv0Bw","1803992405869498858","","","in","","0","0","0","https://x.com/i8n18c8vndqd932/status/1803992405869498858","790594248122912768","i8n18c8vndqd932"
"1803400980517757306","Wed Jun 19 12:14:52 +0000 2024","0","ngeri liat bule bali bawa motor ufh kyk nyawanya ada 9","1803401057927831940","","mpooyaa","in","exo planet","0","0","0","https://x.com/mpooyaa/status/1803401057927831940","1296724997637988352","mpooyaa"
"1802982270799950023","Wed Jun 19 09:07:02 +0000 2024","0","@lumpia24k @el_jastip @_NeverAlonely bule bali mah emang makin gk bisa di nalar ada sajen dimakan kenthu di gunung yg dianggap suci orang bali saat nyepi malah bikin tenda di pantai naik motor berasa jadi VR46 udah gitu cuma pake kolor pula","1803353789925351874","","lumpia24k","in","","0","0","0","https://x.com/Mitologikal/status/1803353789925351874","1647195328767201280","Mitologikal"
"1803086671350829290","Tue Jun 18 15:25:36 +0000 2024","0","Legalitas itu... nilai Universalnya besar. Gak memilih China Bule Bali Dayak dst.. Islam Kristen Bencong Ayam kek Bebek kek. Tua muda dan anak-anak ... itu namanya Universal.","1803086671350829290","","","in","","0","0","0","https://x.com/libccallpacks/status/1803086671350829290","51380667","libccallpacks"
"1803063590271738281","Tue Jun 18 13:53:53 +0000 2024","0","Konten bau ketek di temlen teenyata udah nyampe di tiktok haha bule bali bau udah mau jd pandemi https://t.co/J1jZt8gZr4","1803063590271738281","https://pbs.twimg.com/ext_tw_video_thumb/1803063464031633408/pu/img/sEOmDQ_9Y1a_Fo0e.jpg","","in","Jakarta BSD","0","0","0","https://x.com/DewiTuwuh/status/1803063590271738281","45100171","DewiTuwuh"
"1803036526814822580","Tue Jun 18 12:06:21 +0000 2024","0","Wkwkkwkw lama lama bukan mustahil jadi bule bule bali aja atau jadi Diego Michiles atau Spaso ~","1803036526814822580","","","in","PNK-JKT","0","0","0","https://x.com/zoel711/status/1803036526814822580","80227588","zoel711"
"1802956199740199032","Tue Jun 18 07:11:28 +0000 2024","0","@__ditsss @tvindonesiawkwk Wanjerr belanjanya bule bali","1802962316960682201","","__ditsss","in","Damansara, Selangor","0","1","0","https://x.com/Julpikrar/status/1802962316960682201","1264346866495287296","Julpikrar"
"1802521804071727590","Mon Jun 17 11:32:29 +0000 2024","0","@toe_giman Bule? Bali? Ya udahlah biarin. Tau kan ya.","1802665614688817439","","toe_giman","in","","0","0","0","https://x.com/gr8diazm/status/1802665614688817439","1138479535232389121","gr8diazm"
"1802662094333972791","Mon Jun 17 11:18:29 +0000 2024","52","LABILASA X BESTIE DIPESEN BULE BALI. DIOBOK2 BANGET GAK TUHH https://t.co/2SCTlyefk5 https://t.co/gbZAESEqSY https://t.co/cIIq856VFL","1802662094333972791","https://pbs.twimg.com/ext_tw_video_thumb/1802021808583200768/pu/img/ie8bPamm-8dHsJTB.jpg","","in","","0","0","10","https://x.com/sobatsehat69/status/1802662094333972791","1799186351088361472","sobatsehat69"
"1802547863412687056","Mon Jun 17 03:44:35 +0000 2024","0","Warga Jerman Hendry Bruno Torper ditetapkan tersangka setelah ditangkap Polresta Denpasar dan Polsek Kuta Sabtu 15 Juni 2024. https://t.co/eFrSV6u8vx #Jerman #Bule #buleBali #BuleUgalUgalan #Bali","1802547863412687056","","","in","Surabaya","0","0","0","https://x.com/ngopibareng_id/status/1802547863412687056","1291246080269545472","ngopibareng_id"
"1799833249952547298","Mon Jun 17 02:46:33 +0000 2024","0","@jojoklauz YaAllah semoga dengan barang' korban semua yang rusak bisa cepat terganti dan syukur ya ga ada yg luka ko bule' bali sekarang makin gragas ya :((","1802533259584438555","","jojoklauz","in","","0","0","0","https://x.com/injunloafss/status/1802533259584438555","1728056974418563072","injunloafss"
"1802529027443626052","Mon Jun 17 02:29:44 +0000 2024","0","Lagi-lagi seorang bule menjadi sorotan di media sosial karena tingkah lakunya yang nyeleneh. Kali ini seorang bule pria terlihat merendam mukanya di dalam panci bunga di Restoran Apurva Kempinski Bali. #bule #bali#kempinskibali https://t.co/Q6khSdr5JB","1802529027443626052","https://pbs.twimg.com/ext_tw_video_thumb/1802528954454310912/pu/img/yNiFJqttjJxpN2y0.jpg","","in","Jakarta","0","0","0","https://x.com/ntvnewsid/status/1802529027443626052","1758030653344657408","ntvnewsid"
"1802507995835973636","Mon Jun 17 01:06:10 +0000 2024","0","Remember bule rata-rata kriminil (bule bali)","1802507997576405123","","gacoanisme","in","follow with consent","0","0","0","https://x.com/gacoanisme/status/1802507997576405123","1312284464140095488","gacoanisme"
"1801939250616865233","Sat Jun 15 11:48:27 +0000 2024","0","@bakpaobeku OK ANJAI gini dongz ntar aq kasi bule bali mw?","1801944858355187751","","bakpaobeku","in","166 💋","0","1","0","https://x.com/1975THERE/status/1801944858355187751","1463470030750769158","1975THERE"
"1801896427658063975","Sat Jun 15 08:36:00 +0000 2024","0","Nathan coba kamu di sana motoran terus gak pake baju ugal ugalan dan gak pake helm. Niscaya kamu tidak akan terdeteksi dan jadi kayak bule Bali pada umumnya.","1801896427658063975","","","in","22/7","0","0","0","https://x.com/Prostalgic/status/1801896427658063975","777964512305553408","Prostalgic"
"1801885076990607387","Sat Jun 15 07:50:54 +0000 2024","0","Mantep Punya Bini Montok Gini https://t.co/aMybQIlpAR Masih SMA Jago C0lm3knya https://t.co/cW5G2EEeIL Ng3we Pacar Bule Bali Susu Gede https://t.co/k7x4SM4oc1 Abg cantik pamer aset keindahannya di rumah https://t.co/Qin9KvYjWw","1801885076990607387","","","in","a5jylfcygq4","0","0","0","https://x.com/a5jylfcygq4/status/1801885076990607387","771232075617673216","a5jylfcygq4"
"1801610412980638074","Fri Jun 14 13:46:01 +0000 2024","0","@mademwoiselle bule bali banyak","1801612055926997422","","mademwoiselle","in","Indonesia","0","1","0","https://x.com/masabersiapp/status/1801612055926997422","1188648460666322945","masabersiapp"
"1801555401714057222","Fri Jun 14 10:00:53 +0000 2024","0","bule batak sama bule bali ","1801555401714057222","","","tr","","0","0","0","https://x.com/kayishere_00/status/1801555401714057222","1790993740259291136","kayishere_00"
"1801519673516953960","Fri Jun 14 07:38:55 +0000 2024","0","Seorang bule memukuli pengendara motor wanita di kawasan Kuta Bali. Lokasi tepatnya di Jalan Imam Bonjol Kecamatan Kuta Badung Bali. POT #inewspagi #inews #berita #beritaterkini #news #videoviral #WNA #bule #bali https://t.co/McZf7KYiAS","1801519673516953960","https://pbs.twimg.com/ext_tw_video_thumb/1801519425675460608/pu/img/A5hYB3u_cTAvZH9-.jpg","","in","iNews Tower","0","0","0","https://x.com/officialinews_/status/1801519673516953960","132078023","officialinews_"
"1801395289666032106","Thu Jun 13 23:24:40 +0000 2024","0","oh gitu ya ajg standar ganda penyepong bule dewa2in aja tuh bule bali bali makin rusak ya gegara mrka2 ini rasis ke org luar kota yg bkn dari bali tanpa kunjungan org luar bali pas pandemi juga udh dimiskin bangkrut lu pada jing fakta byk org bali pada zionist islamophobic","1801395289666032106","","","in","","0","0","0","https://x.com/NickCon19/status/1801395289666032106","1795702494619942913","NickCon19"
"1801241868430372973","Thu Jun 13 13:15:01 +0000 2024","3","C0lm3k Masih Pake Seragam SMA https://t.co/hGKtOFpYWj B0Kep B0c1L Jilbab Masih Sempit Banget https://t.co/W3LHU3kKCm Salina Hijab Full Video Koleksi 23 https://t.co/cO4II0kVA7 Ng3we Pacar Bule Bali Susu Gede https://t.co/xFhLuib7Zc","1801241868430372973","","","in","","0","0","0","https://x.com/pfog78em7iz3/status/1801241868430372973","767797544294330368","pfog78em7iz3"
"1801203634216300859","Thu Jun 13 10:46:38 +0000 2024","0","@lovingsihyeon aku mau jastip bule bali boleh ga? * req yg kaya jake","1801204524687974909","","lovingsihyeon","in","","0","1","0","https://x.com/Meongciw/status/1801204524687974909","1715055534951542784","Meongciw"
"1801119524634440102","Thu Jun 13 05:08:52 +0000 2024","2","Kalo sama bule beda gini responmu KONTOL? Memang dibayar buat menjilat bule-bule bali biar tetap rame tuh daerah kah?? https://t.co/ffwOKfHlsq","1801119524634440102","https://pbs.twimg.com/media/GP7cqG4bAAALmVf.jpg","","in","kamar, rumah","0","0","0","https://x.com/fthefallmoon_/status/1801119524634440102","1164052535029592064","fthefallmoon_"
"1801118251054993742","Thu Jun 13 05:03:48 +0000 2024","0","bonon beneran kek bule bali jir","1801118251054993742","","","in","svt's maeumi","0","0","0","https://x.com/dearmyhao_/status/1801118251054993742","1773263027569364992","dearmyhao_"
"1801092779717906911","Thu Jun 13 03:22:36 +0000 2024","2","bule bali pasti suka","1801092779717906911","","","in","","0","0","1","https://x.com/small_mofo_MK3/status/1801092779717906911","1735512332208594944","small_mofo_MK3"
"1800823219932557702","Wed Jun 12 09:31:28 +0000 2024","19","Dan makin pnasaran gimana caranya bikin manusia di luar Indonesia yang punya background subspesialistik mau kerja di Indonesia apalagi mendadak dan gak jelas bgitu hahahhah Yang ada bule bali ngaku2 profesor ikut keciduk Embuh wes","1800823223850094752","","kamilmoon","in","","0","2","3","https://x.com/kamilmoon/status/1800823223850094752","76230223","kamilmoon"
"1800708394241925452","Wed Jun 12 03:24:08 +0000 2024","4","@SekteAxis Pendapatan bali adalah pariwisata. Pembawa uang besar pariwisata kebetulan bule. Bali memperlakukan customer dengan baik kok dibilang anggap kasta tinggi. Oon nih","1800730780987236681","","SekteAxis","in","Earth","0","0","0","https://x.com/BruhGusGus/status/1800730780987236681","1767483638319656960","BruhGusGus"
"1800567524607812027","Tue Jun 11 16:35:25 +0000 2024","1","Sobat RRI kalian tau tentang kasus bule yang bawa kabur truk di Bali? Cek video untuk selengkapnya: https://t.co/g4IFlTILE7 Kode Visual: MG/TMS #bulebali #buletruk #bulekabur https://t.co/LlqpX1G2My","1800567524607812027","https://pbs.twimg.com/ext_tw_video_thumb/1800567222093721600/pu/img/zXlo62CNpXFGoNaZ.jpg","","in","Jakarta Capital Region","0","0","0","https://x.com/RRIPrograma3/status/1800567524607812027","1129936609","RRIPrograma3"
"1800541758469869841","Tue Jun 11 14:53:02 +0000 2024","28","Ng3we Pacar Bule Bali Susu Gede https://t.co/pM3bb5jz7D Siswi SMA ngambil nilai tambahan sama 9urunya malah di https://t.co/KySy9WIrzH Pulang sekolah dipake rame rame https://t.co/Q8IzglsEJv Miss Kay C0lm3k Bikin San9e https://t.co/AC2ciH9t8E","1800541758469869841","","","in","","0","0","2","https://x.com/uu13iyzsf1y1/status/1800541758469869841","785295875257937920","uu13iyzsf1y1"
"1800451076409409788","Tue Jun 11 08:52:42 +0000 2024","0","HAHAHA BULE BALI BANGET ABANG","1800451076409409788","","","tl","2006","1","0","0","https://x.com/marshabytie/status/1800451076409409788","1311480249155153920","marshabytie"
"1800434045501018624","Tue Jun 11 07:45:01 +0000 2024","45","Panya T0ket G3de Desah Colok meM3k ‍ https://t.co/ZzhpBAi7PW BO Mahasiswi Cantik Tog3e Jago Ny3pong ‍ https://t.co/WUuud9LFwv Ngntot Pacar Bule Bali T0ket G3de ‍ https://t.co/XWY8AzDMBu Syakirah Viral Part 8 Full Video ‍ https://t.co/BOiKgxVSJu","1800434045501018624","","","in","","0","0","5","https://x.com/DANIELA27695194/status/1800434045501018624","2163411980","DANIELA27695194"
"1800409876654690469","Tue Jun 11 06:09:10 +0000 2024","0","Video aksi pencurian yang dilakukan WNA itu dibagikan oleh Ni Luh Djelantik. #maling #bule #bulebali #cctv #perhiasan #kalung #baju #pencurian #wna #bali #infobali","1800409924293599551","","lensaRTV","in","Indonesia","0","0","0","https://x.com/lensaRTV/status/1800409924293599551","2393930923","lensaRTV"
"1800388401805602842","Tue Jun 11 04:43:39 +0000 2024","0","Bule bali ni banyak yg sok keras ajg","1800388401805602842","","","in","cxs'","0","0","0","https://x.com/adiousea/status/1800388401805602842","1542849810109120512","adiousea"
"1800387916927226281","Tue Jun 11 04:41:43 +0000 2024","0","CHAOS! Bule di Bali bawa kabur truk dan tabrak pengendara motor! #GarudaTV #Laporan8 #Bulebali #Bali #viral https://t.co/9kQsYW3346","1800387916927226281","https://pbs.twimg.com/ext_tw_video_thumb/1800384493800525824/pu/img/vvC5jVJQ36aM_Lpv.jpg","","in","Indonesia","0","0","0","https://x.com/garudatvnews/status/1800387916927226281","502140136","garudatvnews"
"1800361592846160089","Tue Jun 11 02:57:07 +0000 2024","15","tante honey ngntod bule Bali ‼️Streaming https://t.co/eJjcaJOlhS https://t.co/fd3wDCOIEc https://t.co/Qf9i1YfJb7 semprotcom iOS 18 Tolol seokjin Justice for CBX KDRT LPDP Hot Mess mesin cuci azizaharhan https://t.co/OeQOgNBnl6","1800361592846160089","https://pbs.twimg.com/media/GPwrSE5aQAATjrG.png","","in","","0","0","4","https://x.com/1Capca12785/status/1800361592846160089","1796563049832435712","1Capca12785"
"1785684518881595717","Wed May 01 14:55:40 +0000 2024","0","ini juga Bule bukan Bule Bali kalau yang ini","1785684518881595717","","","in","","0","1","0","https://x.com/NehemiaAmallo/status/1785684518881595717","1538104928069382145","NehemiaAmallo"
"1785662524710633486","Wed May 01 13:28:16 +0000 2024","0","WHATSAPP Bang Leon RawrR : OI OI OI : Susah diterima oleh princess tolong besok sekalian paketin bule Bali juga dong : ARI UNTUNG BELI SENDAL. : CAKEP!!!! : ARIGATOU BANH LEON PACAR SANA.","1785662524710633486","","","in","
𝙄𝙇𝙇𝙐𝙎𝙄𝙊𝙉  —
Selective way; contains with mature themes.
｡⁠.ﾟLive in heaven and I like heaven.
              “Stressed blessed”✦ ","0","0","0","https://x.com/pixiskies/status/1785662524710633486","2410087332","pixiskies"
"1785556462980518389","Wed May 01 06:26:49 +0000 2024","0","Viral! Kelakuan Bule di Bali Mainan Motor hingga Masuk Kolam #baliviral #bulebali #bulemeresahkan #beritabali #infobali #baliterkini #wisatawanasing #bali #wisatawanbali #wnabali #buledibali https://t.co/YUf39Yp4gK","1785556462980518389","https://pbs.twimg.com/ext_tw_video_thumb/1785556006166282240/pu/img/LnnfZenhl-eqedMe.jpg","","in","Yogyakarta","0","0","0","https://x.com/berita_diy/status/1785556462980518389","1287642738683342848","berita_diy"
"1785238276150104320","Tue Apr 30 09:22:27 +0000 2024","0","kyungmin dah cocok jdi bule bali https://t.co/n8PBTgnIId","1785238276150104320","https://pbs.twimg.com/amplify_video_thumb/1785236461878747136/img/fEP26EISoOZ5QbiR.jpg","","in","42 ","0","0","0","https://x.com/ailoftuoz/status/1785238276150104320","1761892788071968768","ailoftuoz"
"1785190091926970514","Tue Apr 30 06:10:59 +0000 2024","0","Kalian ke kafe doang harus stylish ya. Kalah dong sama bule bali ke kafe kaos kutang celana boxer sama sendal jepit","1785190091926970514","","","in","","0","0","0","https://x.com/19f3bri91/status/1785190091926970514","442006717","19f3bri91"
"1784180482340712630","Sat Apr 27 23:12:30 +0000 2024","0","@tanyakanrl Justru muka2 kyk praz bs dpt bule spek eropa. Nah muka2 mbak2 standar desa jg bs dpt bule kok. Spek bule bali. Yg miskin dan ga ada kerjaan .","1784360000376492236","","tanyakanrl","in","Tabanan, Bali","0","0","0","https://x.com/tama_arivta/status/1784360000376492236","410032584","tama_arivta"
"1784190529523335664","Sat Apr 27 11:59:05 +0000 2024","1","Pas trip ke Raja Ampat kemarin ketemu bule-bule yang diss tipikal bule Bali yg I m going to find myself in Bali ‍️terus makan super organic food pdhl cuma avocado toast granola muesli. Terus foto di beach club. WHITE DUDE(S) KALIAN LAH YG BIKIN DEMAND NYA HAHAHAHA.","1784190529523335664","","","in","a palace by the sea.","0","0","1","https://x.com/iTatya/status/1784190529523335664","42841155","iTatya"
"1784166818267160743","Sat Apr 27 10:24:52 +0000 2024","0","Kenapa sih bule bule bali hobi bgt naik motor sambil teriak teriak atau engga muter musik kenceng kayak angkot","1784166818267160743","","","in","","0","1","0","https://x.com/canispell/status/1784166818267160743","980441625481551872","canispell"
"1784119798856872028","Sat Apr 27 07:18:02 +0000 2024","0","Kyk bule bali ntar ","1784119798856872028","","","in","Sheffield, England","0","1","0","https://x.com/kentomiyauraaa/status/1784119798856872028","1429361011178369029","kentomiyauraaa"
"1784118290488741892","Sat Apr 27 07:14:06 +0000 2024","0","@LALINEKO_ Kek bule bali yang sewa motor seenak jidatnya","1784118809219256658","","LALINEKO_","in","","0","1","0","https://x.com/0327ariesssss/status/1784118809219256658","1539928431865245696","0327ariesssss"
"1783737622269165871","Fri Apr 26 22:24:38 +0000 2024","0","@Setobeli_Mungil @Sleepyasever pernah cium aroma bule bali kayak bau keringat gelandangan gitu.","1783985565031125033","","Stobeli_Kochok","in","","0","1","0","https://x.com/ans_steph/status/1783985565031125033","1498207797120745476","ans_steph"
"1783884193036218598","Fri Apr 26 15:41:49 +0000 2024","1","Semerbak bule bali","1783884193036218598","","","in","","0","0","0","https://x.com/menjadianonim/status/1783884193036218598","126294946","menjadianonim"
"1783738294918152489","Fri Apr 26 06:02:04 +0000 2024","2","sukurin (ke kbsnya) kebiasaan banget ke indo/bali semena-mena ngga ngikutin aturan IHHH sama aja kayak bule bule bali lainnya","1783738294918152489","","","in","21+ multifan, daily, rant","0","0","0","https://x.com/fuyunohanangis/status/1783738294918152489","1315667789055578113","fuyunohanangis"
"1783680078670610827","Fri Apr 26 02:16:48 +0000 2024","0","@idextratime info lawan sepadan hyung udah bule bali udah","1783681604923347418","","idextratime","in","Manchester, England","0","1","0","https://x.com/nawliban/status/1783681604923347418","1270369706432585728","nawliban"
"1783613884831805665","Fri Apr 26 02:15:53 +0000 2024","0","@yogiadipras @unmagnetism Mantap bule bali","1783681373951455592","","yogiadipras","ht","Osaka-shi Konohana-ku, Osaka","0","0","0","https://x.com/puankonoha/status/1783681373951455592","1368362661096787968","puankonoha"
"1783559616372334623","Thu Apr 25 18:12:04 +0000 2024","8","Bule bali mau kenalan dong sini...","1783559616372334623","","","in","","0","0","0","https://x.com/chachuby555/status/1783559616372334623","1772838048948228096","chachuby555"
"1783559520318550391","Thu Apr 25 18:11:41 +0000 2024","3","Bule bali mau kenalan dong...","1783559520318550391","","","in","","0","0","0","https://x.com/chachuby555/status/1783559520318550391","1772838048948228096","chachuby555"
"1783046517949079619","Wed Apr 24 11:01:08 +0000 2024","0","@starfess hyo beneran kyk bule bali ","1783088781761122472","","starfess","in","","0","0","0","https://x.com/witheapril/status/1783088781761122472","1534681475119214593","witheapril"
"1782972992777240588","Wed Apr 24 03:21:02 +0000 2024","5","MamKin Sam2 Cwe asuhnya C0lm3k https://t.co/mi38AVJN2B B0k3p Uting T0ketnya Yourbae Mahasiswi Cantik Tog3e https://t.co/wjdONiVbDZ Hijab bin4L Live Ny3pong K0nToI 1 https://t.co/n6XbfhCfzR Ngntot Pacar Bule Bali T0ket G3de https://t.co/MLtDETRfPy","1782972992777240588","","","in","","0","0","1","https://x.com/rt5l2f6ac64/status/1782972992777240588","798486082270556160","rt5l2f6ac64"
"1782922407277474214","Wed Apr 24 00:00:01 +0000 2024","1","bule dapet kerjaan album cover $200 kemurahan buat Indo ya pasti dikerjain beda nilai duit. bule Bali byk yg jadi outsourcer pekerja lokal dimereka dapet ribuan dollar sampe kita $500-700 juga dikerjain. untung gede mereka tinggal di Bali pula ya betah","1782922407277474214","","","in","","0","0","0","https://x.com/Yaitu12921776/status/1782922407277474214","1283015320618205184","Yaitu12921776"
"1782839107959550320","Tue Apr 23 18:29:01 +0000 2024","8","Intan Pangandaran ABG SMA VCS Disebar Mantan Part 2 https://t.co/22OZVKqepe Ng3we Pacar Bule Bali Susu Gede https://t.co/QUNIMaMohw Ketagihan sama MeM3k ponakan sendiri https://t.co/6q0o2wKWSJ B0Kep Shinju Bumil ngwe Live Bling2 https://t.co/EnOAaFv8mb","1782839107959550320","","","in","","0","0","2","https://x.com/9ftd0lcu3/status/1782839107959550320","799126384442380288","9ftd0lcu3"
"1782667388884013415","Tue Apr 23 07:06:40 +0000 2024","14267","Di ewe 2 kontol bule Bali nikmatnya sampe ubun-ubun ... https://t.co/a0noSzQs6m","1782667388884013415","https://pbs.twimg.com/amplify_video_thumb/1782665131639660545/img/lf7NLjGa7aX76llu.jpg","","in","","25","42","4092","https://x.com/NitaPasutri/status/1782667388884013415","1729210658888060928","NitaPasutri"
"1781700582467834243","Sat Apr 20 15:07:06 +0000 2024","1","@esgrimmmm Itu bule Bali mix Swedia ","1781701131154129064","","esgrimmmm","in","","0","0","0","https://x.com/NurrAfdhal/status/1781701131154129064","1647136435928174593","NurrAfdhal"
"1780994643926380919","Thu Apr 18 16:19:47 +0000 2024","0","segini doang bule bali?!?","1780994643926380919","","","in","semua jadi teman","0","0","0","https://x.com/akunicho/status/1780994643926380919","1681513251333611522","akunicho"
"1780976268181414370","Thu Apr 18 15:08:37 +0000 2024","0","@idextratime @bliblidotcom Ini bule bali suruh si abang2an skena nya aja suruh turun sini. Segitu doang U-23 nya","1780976734055362947","","idextratime","in","Cibinong, Indonesia","0","0","0","https://x.com/RE_Prasetyo21/status/1780976734055362947","2788099488","RE_Prasetyo21"
